{
  "schema_version": "autoform.process_rag_evidence_bundle.r16.v1",
  "object_type": "EvidenceBundle",
  "phase": "R16",
  "evidence_bundle_id": "evidence_r16_process_rag_sample",
  "query": "DC04 D-20 blank thickness process route",
  "filters": {
    "material_grade": "DC04",
    "blank_thickness_mm": 1.0,
    "process_action": "D-20"
  },
  "source_refs": [
    {
      "source_id": "source_enterprise_internal_dataset_pending",
      "title": "Enterprise internal dataset placeholder",
      "path_or_url": "pending_internal_directory",
      "source_type": "internal_pending",
      "captured_at": "pending",
      "reviewed": false,
      "permission_level": "P2",
      "license_status": "pending_internal_permission",
      "review_status": "candidate",
      "applicability": "R13 placeholder for future internal material process case and quality data",
      "limitation": "No data ingestion until owner permission source hash and confidentiality are confirmed"
    }
  ],
  "evidence_refs": [
    {
      "evidence_id": "record_r14_sample_material_001",
      "source_id": "source_enterprise_internal_dataset_pending",
      "source_hash": "d9ef6dbbe85f221488897c4ddc02333d2b5e63d9a8b820d2e9d9253beb48737e",
      "artifact_uri": "enterprise_data/r14_small_batch_samples.jsonl",
      "evidence_type": "cleaned_record"
    },
    {
      "evidence_id": "record_r14_sample_process_001",
      "source_id": "source_enterprise_internal_dataset_pending",
      "source_hash": "4b99e9162c9569b0fe9c37daf79a95b00e0f24ae1efcb59b024f085900c843e8",
      "artifact_uri": "enterprise_data/r14_small_batch_samples.jsonl",
      "evidence_type": "cleaned_record"
    }
  ],
  "card_refs": [
    {
      "card_id": "pkc_r15_parameter_blank_thickness_pending_001",
      "card_type": "ParameterWindow",
      "source_id": "source_enterprise_internal_dataset_pending",
      "source_permission_level": "P2",
      "version": "pending",
      "review_status": "candidate",
      "license_status": "pending_internal_permission",
      "allowed_usage": "candidate_knowledge_card_only",
      "applicability": {
        "applicable_materials": [
          "DC04"
        ],
        "part_features": [
          "generic_sheet_metal_draw_part_pending_geometry"
        ],
        "process_actions": [
          "D-20"
        ],
        "applicable_lines": [
          "pending_line_review"
        ],
        "conflict_status": "none"
      },
      "limitation": "No data ingestion until owner permission source hash and confidentiality are confirmed",
      "score": 14,
      "ranking_reasons": [
        "text_match:20",
        "text_match:blank",
        "text_match:d",
        "text_match:dc04",
        "text_match:process",
        "text_match:thickness",
        "filter_match:material_grade",
        "filter_match:blank_thickness_mm",
        "filter_match:process_action"
      ],
      "formal_index_allowed": false
    },
    {
      "card_id": "pkc_r15_process_case_dc04_d20_pending_001",
      "card_type": "ProcessCase",
      "source_id": "source_enterprise_internal_dataset_pending",
      "source_permission_level": "P2",
      "version": "pending",
      "review_status": "candidate",
      "license_status": "pending_internal_permission",
      "allowed_usage": "candidate_knowledge_card_only",
      "applicability": {
        "applicable_materials": [
          "DC04"
        ],
        "part_features": [
          "generic_sheet_metal_draw_part_pending_geometry"
        ],
        "process_actions": [
          "D-20"
        ],
        "applicable_lines": [
          "pending_line_review"
        ],
        "conflict_status": "none"
      },
      "limitation": "No data ingestion until owner permission source hash and confidentiality are confirmed",
      "score": 12,
      "ranking_reasons": [
        "text_match:20",
        "text_match:d",
        "text_match:dc04",
        "text_match:process",
        "filter_match:material_grade",
        "filter_match:blank_thickness_mm",
        "filter_match:process_action"
      ],
      "formal_index_allowed": false
    }
  ],
  "summary": "R16 candidate EvidenceBundle matched 2 process knowledge cards: ParameterWindow, ProcessCase; conflict_status=none.",
  "applicability": "materials=DC04; process_actions=D-20",
  "limitation": "No data ingestion until owner permission source hash and confidentiality are confirmed | Candidate bundle only; it cannot update formal engineering state or submit AutoForm solving.",
  "confidence": "low",
  "review_status": "candidate",
  "human_review_status": "required",
  "conflict_status": "none",
  "retrieval_run": {
    "retrieval_run_id": "retrieval_evidence_r16_process_rag_sample",
    "index_version": "autoform.process_rag.r16.v1",
    "candidate_card_count": 6,
    "matched_card_count": 2,
    "formal_index_allowed_count": 0,
    "filters_applied": {
      "material_grade": "DC04",
      "blank_thickness_mm": 1.0,
      "process_action": "D-20"
    },
    "ranking_explanation": [
      {
        "card_id": "pkc_r15_parameter_blank_thickness_pending_001",
        "score": 14,
        "reasons": [
          "text_match:20",
          "text_match:blank",
          "text_match:d",
          "text_match:dc04",
          "text_match:process",
          "text_match:thickness",
          "filter_match:material_grade",
          "filter_match:blank_thickness_mm",
          "filter_match:process_action"
        ]
      },
      {
        "card_id": "pkc_r15_process_case_dc04_d20_pending_001",
        "score": 12,
        "reasons": [
          "text_match:20",
          "text_match:d",
          "text_match:dc04",
          "text_match:process",
          "filter_match:material_grade",
          "filter_match:blank_thickness_mm",
          "filter_match:process_action"
        ]
      }
    ],
    "excluded_cards": [
      {
        "card_id": "pkc_r15_material_dc04_pending_001",
        "card_type": "MaterialCard",
        "source_id": "source_enterprise_internal_dataset_pending",
        "reasons": [
          "process_action_filtered"
        ]
      },
      {
        "card_id": "pkc_r15_operation_route_d20_pending_001",
        "card_type": "OperationRoute",
        "source_id": "source_enterprise_internal_dataset_pending",
        "reasons": [
          "thickness_filtered"
        ]
      },
      {
        "card_id": "pkc_r15_quality_traceability_gate_001",
        "card_type": "QualityCriteria",
        "source_id": "source_enterprise_internal_dataset_pending",
        "reasons": [
          "process_action_filtered",
          "thickness_filtered"
        ]
      },
      {
        "card_id": "pkc_r15_public_literature_metadata_arxiv_001",
        "card_type": "ProcessCase",
        "source_id": "source_arxiv_api_metadata",
        "reasons": [
          "material_filtered",
          "process_action_filtered",
          "thickness_filtered"
        ]
      }
    ],
    "blocked_actions": [
      "write_formal_engineering_state",
      "submit_solver",
      "control_gui"
    ]
  },
  "created_at": "2026-06-03T05:00:00+00:00"
}
